{
 "subject": "jane-murphy",
 "capture_budget": 8,
 "assets": [
  {
   "id": "asset-01",
   "candidate_source": "search_images",
   "page_url": "https://www.example.com/leadership/jane-murphy",
   "image_url": "https://cdn.example.com/is/image/example/jane-murphy?$PRESET$",
   "image_url_best": "https://cdn.example.com/is/image/example/jane-murphy?wid=2400",
   "native_w": 2000,
   "native_h": 1452,
   "host": "example.com",
   "caption_verbatim": "Jane Murphy, Chief Operations Officer",
   "title_attached": "Chief Operations Officer",
   "title_outdated": false,
   "credit": "",
   "licence": "",
   "context": "corporate headshot",
   "descriptive_title": "Corporate headshot, Example Group leadership page",
   "dedupe_group": "g1",
   "rank": 1,
   "state": "shown",
   "file": "img/asset-01.png",
   "sidecar": "img/asset-01.json",
   "placement_mm": 76.2,
   "verification": {
    "by": "view",
    "matched_against": "asset-01 corporate headshot; the published caption names the subject",
    "result": "match"
   },
   "attempts": 1
  },
  {
   "id": "asset-02",
   "candidate_source": "search_images",
   "page_url": "https://localnews.example.co/awards-2025",
   "image_url": "https://media.localnews.example.co/2025/awards-murphy.jpg",
   "image_url_best": "https://media.localnews.example.co/2025/awards-murphy.jpg",
   "native_w": 1600,
   "native_h": 1067,
   "host": "localnews.example.co",
   "caption_verbatim": "Jane Murphy accepts the operations award",
   "title_attached": "COO, Example Group",
   "title_outdated": false,
   "credit": "",
   "licence": "",
   "context": "stage",
   "descriptive_title": "On stage at the 2025 regional manufacturing awards",
   "dedupe_group": "g2",
   "rank": 2,
   "state": "shown",
   "file": "img/asset-02.png",
   "sidecar": "img/asset-02.json",
   "placement_mm": 76.2,
   "verification": {
    "by": "view",
    "matched_against": "asset-01 corporate headshot; the published caption names the subject",
    "result": "match"
   },
   "attempts": 1
  },
  {
   "id": "asset-03",
   "candidate_source": "search_images",
   "page_url": "https://forum.example.org/2025/panel-resilience",
   "image_url": "https://forum.example.org/media/panel-2025.jpg",
   "image_url_best": "https://forum.example.org/media/panel-2025.jpg",
   "native_w": 1200,
   "native_h": 800,
   "host": "forum.example.org",
   "caption_verbatim": "Pictured: Jane Murphy, Director of Supply Chain",
   "title_attached": "Director of Supply Chain",
   "title_outdated": true,
   "credit": "",
   "licence": "",
   "context": "event",
   "descriptive_title": "Panel session, Example Supply Chain Forum",
   "dedupe_group": "g3",
   "rank": 3,
   "state": "shown",
   "file": "img/asset-03.png",
   "sidecar": "img/asset-03.json",
   "placement_mm": 76.2,
   "verification": {
    "by": "view",
    "matched_against": "asset-01 corporate headshot; the published caption names the subject",
    "result": "match"
   },
   "attempts": 1
  },
  {
   "id": "asset-04",
   "candidate_source": "search_images",
   "page_url": "https://trade.example.net/features/operations-2025",
   "image_url": "https://trade.example.net/img/murphy-portrait.jpg",
   "image_url_best": "https://trade.example.net/img/murphy-portrait.jpg",
   "native_w": 1400,
   "native_h": 1867,
   "host": "trade.example.net",
   "caption_verbatim": "Jane Murphy photographed at the Example Group site",
   "title_attached": "Chief Operations Officer",
   "title_outdated": false,
   "credit": "",
   "licence": "",
   "context": "press",
   "descriptive_title": "Trade quarterly commissioned portrait",
   "dedupe_group": "g4",
   "rank": 4,
   "state": "shown",
   "file": "img/asset-04.png",
   "sidecar": "img/asset-04.json",
   "placement_mm": 80.0,
   "verification": {
    "by": "view",
    "matched_against": "asset-01 corporate headshot; the published caption names the subject",
    "result": "match"
   },
   "attempts": 1
  },
  {
   "id": "asset-05",
   "candidate_source": "search_images",
   "page_url": "https://studio.example.art/about",
   "image_url": "https://studio.example.art/img/portrait.jpg",
   "native_w": 900,
   "native_h": 900,
   "host": "studio.example.art",
   "caption_verbatim": "Jane Murphy in the studio",
   "title_attached": "Ceramic artist",
   "context": "other",
   "descriptive_title": "Namesake portrait, studio site",
   "dedupe_group": "g5",
   "rank": 5,
   "state": "wrong_person",
   "reason": "captured, inspected, WRONG PERSON — discarded",
   "verification": {
    "by": "view",
    "matched_against": "asset-01; a different person",
    "result": "no-match"
   },
   "attempts": 2
  }
 ],
 "summary": {
  "found_distinct": 5,
  "attempted": 5,
  "verified": 4,
  "shown": 4,
  "budget_applied": false
 }
}